,target,candidate,rouge1,rouge2,rogueL,rogueLs,chrf
88,"[""Obesity should be defined by a person's health - not just their weight, says a new Canadian clinical guideline.""]","['It also advises doctors to go beyond simply recommending diet and exercise. Instead, they should focus on the root causes of weight gain and take a holistic approach to health. The guideline, which was published in the Canadian Medical Association Journal on Tuesday, specifically admonished weight-related stigma against patients in the health system.']",0.1643835616438356,0.0,0.1095890410958904,0.1095890410958904,29.188190724448184
89,['Boots has been accused of refusing to cut the cost of one of its morning-after pills for fear of criticism from campaigners.'],"['The British Pregnancy Advisory Service (BPAS), which provides abortion care, wants Boots and other pharmacies to reduce the cost of emergency contraception Levonelle. Boots told the BPAS it wanted to avoid ""incentivising inappropriate use"". The company said it was ""disappointed by the focus"" BPAS had taken.']",0.14492753623188406,0.059701492537313425,0.14492753623188406,0.14492753623188406,24.112993484733753
90,"[""Few Germans had expected to enjoy all the trappings of a traditional Christmas this year but new countrywide restrictions, which come into force on Wednesday, will limit festivities to the smallest of family gatherings. No carolling, no parties and even Germany's much loved glühwein stalls will close, as drinking outdoors is banned.""]","['By Jenny HillBBC News, Dresden Announcing the measures at the weekend, Chancellor Angela Merkel said that an existing ""lockdown light"", which closed bars, restaurants, arts and leisure facilities at the beginning of November, had not done enough to tackle Germany\'s second wave. The country has experienced record numbers of infections and deaths in the past fortnight and intensive care units are filling up. What are Germany\'s lockdown measures? There\'ll be no let up over New Year either.']",0.19402985074626866,0.01515151515151515,0.11940298507462688,0.11940298507462688,31.012905061547308
91,"[""South Korea's president has promised the wreckage of the Sewol ferry will be raised at the earliest opportunity. But is it that straightforward?""]","['By Roland HughesBBC News The ferry sank in April 2014 causing the deaths of 304 people, and now sits on its side on the sea bed. Experts say the salvage operation could be complicated by a number of factors. But the government is hopeful it can be lifted in one piece - and has put forward plans for how to do so.']",0.2352941176470588,0.0,0.16470588235294117,0.16470588235294117,26.730473875686645
92,['More than 600 workers at a food factory are being tested for coronavirus after 19 colleagues tested positive.'],"['A mobile testing unit has been set up outside Peter\'s Food Service unit in Bedwas, Caerphilly. The pies and pasties maker said it had been ""working in a Covid environment for seven months"" with safety measures reviewed on a weekly basis. Caerphilly was the first county in Wales to be placed in a local lockdown following a spike in cases.']",0.07594936708860758,0.0,0.07594936708860758,0.07594936708860758,21.329933759998102
93,['A historian has suggested artefacts found in the Highlands and Islands and held in museums outside the area could be returned via community purchases.'],"['By Jackie O\'BrienBBC Scotland news Prof James Hunter\'s comment comes as crofters in Assynt prepare to mark 25 years since the North Lochinver Estate was brought into public ownership. He said the same powers used for community buyouts of land and buildings could be used for ""portable assets"". These include the Lewis Chessmen and the St Ninian\'s Isle Treasure, he said.']",0.18181818181818182,0.02325581395348837,0.11363636363636363,0.11363636363636363,28.902041617023915
94,['The makers of hit American TV series Glee are to release a mini-album of Madonna cover songs.'],"['The Power Of Madonna will be the third official record from the show and will be released on Monday 26 April. The first two Glee albums have sold half a million copies each in the US with single Don\'t Stop Believin\' going to number six in the UK singles chart. Producers say it marks ""the next official chapter in the Glee music songbook"".']",0.14634146341463417,0.024999999999999998,0.0975609756097561,0.0975609756097561,26.90454901198199
95,"[""A set of hand puppets given to siblings by the creator of a famous children's television show are expected to fetch thousands of pounds at auction.""]","['Vicky Golding and Max Jowett received a set of Sooty, Sweep and Soo puppets from Harry Corbett, who invented the famous puppeting trio. Their father Derek Jowett was a friend of the magician and presenter, who they say gave them the gift when learning that their mother was ill with cancer. The auction is set for 19 November.']",0.21176470588235294,0.048192771084337345,0.18823529411764706,0.18823529411764706,27.143744470947652
96,['Patients from West Cumbria requiring high-risk surgery will have to travel to Carlisle as a result of changes announced by the local NHS trust.'],"['Complex operations will no longer take place at the West Cumberland Hospital in Whitehaven, the North Cumbria University Hospital Trust said. The distance between the two hospitals is almost 40 miles. A spokesman for the Royal College of Nursing (RCN) said the move ""made sense in clinical terms"".']",0.1917808219178082,0.0,0.136986301369863,0.136986301369863,24.92386314945874
97,['Pupils living near a legal red light district have been propositioned for sex and their head teacher said he feared one of them could be abducted.'],"['The Managed Approach (MA) area in Holbeck, Leeds, allows sex workers to operate without fear of prosecution. One girl said she was asked for sex as she walked through the zone to school and head teacher Ben Mallinson said he was worried pupils could be harmed. Leeds council urged anyone with concerns to get in touch.']",0.2926829268292683,0.09999999999999999,0.21951219512195125,0.21951219512195125,33.420684764570055
98,"[""Doctor Who, Call the Midwife and Mrs Brown's Boys are among the shows that will be in this year's Christmas TV schedule, the BBC has revealed.""]","['It has been ""a real struggle"" to make the usual range of festive shows during Covid, the BBC\'s Charlotte Moore said. But, she added, the stars and crews ""pulled out all the stops"". ""Some of the big talent and the production teams have rallied together, and we feel it\'s really important to have a good Christmas."" The BBC\'s Christmas TV line-up includes special episodes The Goes Wrong Show, Ghosts, Not Going Out, King Gary, Motherland and the return of The Vicar of Dibley.']",0.19130434782608696,0.05309734513274336,0.1391304347826087,0.1391304347826087,27.880409648939438
99,"[""The widespread coverage and high drama of the Fifa Women's World Cup has sparked football fever across the UK, with a record-breaking 6.9 million people watching England's most recent clash. There were still far more people watching men's World Cup matches, with 26.5 million viewers tuning in to see England knocked out last year. But there are some ways women's football is hitting the back of the net - while the male strand of the sometimes-beautiful game bounces disappointingly off the crossbar.""]","[""By Alice EvansBBC News 1. Value for money For the men's World Cup last summer, your pockets had to be bulging with Russian roubles if you wanted a chance to see football come home (or not) with your own eyes. The best seats in the house for the France v Croatia men's final cost an eye-watering 66,000 roubles (£824.44).""]",0.22222222222222218,0.052980132450331126,0.1568627450980392,0.1568627450980392,20.7338671094235
