,target,candidate,rouge1,rouge2,rogueL,rogueLs,chrf
44,['The Bloodhound vehicle has become the third fastest British car of all time - unofficially.'],"[""By Jonathan AmosBBC Science Correspondent The arrow-shaped racer clocked a speed of 461mph (741km/h) as it powered across a dried-out lakebed in southern Africa's Kalahari desert on Friday. This mark tops the 403mph (648km/h) recorded by Donald Campbell in his Bluebird CN7 car in 1964. The only British cars to have gone faster are Thrust2 and Thrust SSC which both got well above 600mph (965km/h).""]",0.11764705882352941,0.0,0.07058823529411765,0.07058823529411765,20.770166261452744
45,"[""Ten years ago, two deadly bombs ripped through two nightclubs on the Indonesian island of Bali and killed 202 people - mostly foreigners on holiday. The attacks changed the image of Indonesia as a safe place to visit and dealt a deadly blow to Bali's booming tourist trade.""]","['By Karishma VaswaniBBC News, Jakarta Ni Luh Erniati remembers that day vividly. ""No one wanted to tell me what happened to my husband,"" she said, trying to contain her tears. ""He was the bartender at the Sari Club that night.']",0.0909090909090909,0.0,0.04545454545454545,0.04545454545454545,19.622764316177562
46,"['In 2015, an unassuming-looking Bill Gates came on stage at the TED conference in Vancouver to issue a dire warning.']","['By Jane WakefieldTechnology reporter ""If anything kills over 10 million people over the next few decades, it is likely to be a highly infectious virus rather than war,"" he told the audience. His prescient words picked up some coverage at the time, including from the BBC - but largely went unheeded. But now, the video of this talk has now been viewed more than 64 million times - with many people more interested in the reasons behind that speech than the talk itself.']",0.09803921568627451,0.020000000000000004,0.058823529411764705,0.058823529411764705,19.887312883049507
47,['Prince Harry and Meghan have moved into their new home in Windsor ahead of the birth of their first child.'],"['It was announced last year the Duke and Duchess of Sussex would be leaving Kensington Palace. Their new home - Frogmore Cottage - sits in the grounds of Frogmore House, where they held their wedding reception in May 2018. Extensive renovations were carried out at the property in preparation for the move.']",0.2571428571428572,0.0588235294117647,0.22857142857142856,0.22857142857142856,27.381820607054458
48,['A US soldier captured by the Taliban for five years has pleaded guilty at a military court in North Carolina to desertion and misbehaviour before the enemy.'],"['Army Sergeant Bowe Bergdahl now faces the possibility of life imprisonment. Who is Bowe Bergdahl? Sgt Bergdahl was released in March 2015, five years after being captured by Afghan Taliban, in a controversial exchange for five Taliban officials being held at Guantanamo Bay. The prisoner swap came after secret talks between the US government and the Taliban, brokered by Qatar.']",0.29885057471264365,0.09411764705882353,0.18390804597701152,0.18390804597701152,30.73048164150846
49,['A dental student accused of plotting to commit an act of terrorism in the UK told police he bought 500 ball bearings and a catapult to use for hunting.'],"['Mohammed Awan, whose brother Rizwan Awan killed dozens of people in a bomb blast in Iraq in 2016, was arrested after buying the items online. Sheffield Crown Court heard he told police he was a keen fisherman and was researching hunting with a catapult. Mr Awan, 24, from Huddersfield, denies three terrorism-related charges.']",0.2891566265060241,0.07407407407407407,0.21686746987951805,0.21686746987951805,32.32005292624219
50,['An attempted car bomb attack in Belfast city centre has been widely condemned.'],"['Police have said the bomb contained 60k (132lbs) of home-made explosives. Shoppers at Victoria Square and nearby residents had to be evacuated overnight and there was traffic disruption throughout much of the city centre. Peter Robinson, NI first minister ""People are appalled at the mentality of people who carry out these kind of activities.']",0.08823529411764705,0.030303030303030304,0.08823529411764705,0.08823529411764705,22.484938185052343
51,['A new £25m sports complex with an Olympic-sized swimming pool has been floated by council bosses as the solution to ageing leisure facilities in Winchester.'],"['The new centre would replace the 42-year-old River Park Leisure Centre which needs at least £3m of repairs. Winchester City Council has agreed to develop plans to build a new out-of-town centre at Bar End. If it goes ahead, it is expected to take three years to complete.']",0.20512820512820515,0.02631578947368421,0.10256410256410257,0.10256410256410257,26.898901769585798
52,['Russian opposition leader Alexei Navalny has been sentenced to 15 days in prison for handing out leaflets to publicise a forthcoming demonstration.'],['His imprisonment bars him from taking part in the planned rally on 1 March. Navalny was given a suspended sentence for defrauding two firms in December. He says the legal cases against him are motivated by his opposition to President Vladimir Putin.'],0.18749999999999997,0.0,0.09374999999999999,0.09374999999999999,31.50773029534942
53,"['A bridge, which was saved from demolition as part of a campaign when the M5 motorway was built, could soon have water flowing underneath it again.']","['Westfield canal bridge near Stonehouse, Gloucestershire, was saved in 1969 by a woman who stood on it for a day to prevent workmen from blowing it up. A scheme to restore the Stroudwater Canal includes plans to reinstate the waterway beneath it. A £15m bid for Heritage Lottery cash for the project has begun.']",0.2,0.025641025641025637,0.17500000000000002,0.17500000000000002,31.317713390330855
54,['A chronology of key events:'],"['870s - First Norse settlements on Iceland. Previous inhabitants were a small number of Irish monks. 930 - An annual parliament - the Althing - established, to make laws and solve disputes.']",0.12121212121212122,0.0,0.12121212121212122,0.12121212121212122,11.164474710048731
55,['The president of Sri Lanka has said foreign judges and prosecutors should not be involved in an investigation into allegations of war crimes.'],"['By Azzam AmeenBBC Sinhala, Colombo In a BBC interview, President Maithripala Sirisena said the country did not need to ""import"" specialists. Both the army and the Tamil Tiger rebels are accused of atrocities in the civil war that ended in 2009. The government previously backed a UN resolution calling for a war crimes court supported by foreign judges.']",0.271604938271605,0.05063291139240506,0.14814814814814814,0.14814814814814814,31.679707609019708
56,"['Girls start to see themselves as less innately talented than boys do when they are only six years old, a group of US researchers has said.']","['By James GallagherHealth and science reporter, BBC News website They said the ""disheartening"" results suggested the problem could snowball to affect future careers. The study on 400 children, in the journal Science, initially found both five-year-old boys and girls thought their own gender was ""brilliant"". But then only one year later, gender differences had emerged.']",0.16867469879518074,0.0,0.07228915662650602,0.07228915662650602,24.344823526387717
57,['The UK government says it has started negotiations with a Japanese firm over a new nuclear power station on Anglesey.'],"['Energy secretary Greg Clark told MPs on Monday that public money could also be invested into Wylfa Newydd. The proposal has been on the horizon for a number of years, but ministers say the latest development is a major step forward. It is hoped work on the new plant could begin by 2020.']",0.19178082191780824,0.0,0.13698630136986303,0.13698630136986303,21.353271979127577
58,['Thousands of swimmers are expected to head to Windermere this weekend for the 2011 Great North Swim.'],"['The event was cancelled in September 2010 after potentially toxic algae was discovered in the water by the Environment Agency. In an effort to avoid a repeat, the 2011 event has been scheduled for earlier in the year. Organisers are expecting about 10,000 swimmers to participate in the three-day event.']",0.2028985507246377,0.029850746268656716,0.08695652173913045,0.08695652173913045,29.306314606212553
59,"['Weetabix must remove a children\'s game app over concerns it could make youngsters feel ""inferior"" for not eating the cereal.']","['The Advertising Standards Authority (ASA) said the WeetaKid app prompts such as ""What?! No Weetabix?!"" were persuasive and negative. The Northamptonshire-based firm said it took ""great care"" to ensure that its marketing complied with regulations. There had been a complaint that the app could make children feel ""unpopular"".']",0.2571428571428572,0.029411764705882353,0.1714285714285714,0.1714285714285714,29.915863806103065
60,"['Police have criticised the ""disgusting"" actions of bystanders who filmed an officer who was knocked off his bike instead of helping the rider.']","['The officer was pursuing a stolen bike in Coventry when he was knocked over in Stoney Stanton Road on Wednesday. The officer was taken to hospital but discharged with ""bumps, bruises and a bit of shock"". West Midlands Police Road Harm Reduction Team tweeted it was ""not what any of us come into work for"".']",0.23076923076923078,0.02631578947368421,0.12820512820512822,0.12820512820512822,32.29725997371662
61,['A review is examining if weight loss surgery should be offered to greater numbers of obese people in Wales.'],"['Welsh ministers are awaiting a report into criteria deciding who is eligible for operations which could mean surgery is available for the less obese. The review is also considering the cost to the NHS of changing guidelines. One surgeon said Wales should eventually lower the threshold at which people qualify for NHS-funded surgery, as recommended by a health watchdog.']",0.25316455696202533,0.025974025974025976,0.15189873417721522,0.15189873417721522,28.588096667009754
62,['Olympic champion Jessica Ennis-Hill has been made a dame in the New Year Honours list.'],"['The 30-year-old heptathlete gets the award for her services to athletics. Dame Jessica, who won gold at London 2012 Olympics and silver four years later in Rio, announced her retirement from the sport in October. Paralympic gold medallists Grace Clough and Will Bayley have both been honoured with MBEs.']",0.17910447761194026,0.0,0.08955223880597013,0.08955223880597013,24.346222987730922
63,"[""Five Indian students facing charges of sedition after organising a protest at Delhi's prestigious Jawaharlal Nehru University (JNU), have resurfaced.""]",['The protest on 9 February was over the 2013 hanging of Kashmiri man Mohammed Afzal Guru and allegedly saw the chanting of anti-India slogans. Police arrested JNU student union head Kanhaiya Kumar on sedition charges but also named five other organisers. The arrest led to protests and clashes in Delhi and universities across India.'],0.18421052631578946,0.0,0.07894736842105263,0.07894736842105263,35.564575187246476
64,"['Tourists could face a ""shock"" this summer when they travel abroad according to foreign currency experts.']","[""Those that buy euros at the airport can expect to receive around 98 euro cents for their pound. Better rates can be found by buying in advance, with the Post Office offering €1.0819. But that's still a long way from the summer of 2015, when tourists were getting at least €1.32 for their pound.""]",0.136986301369863,0.0,0.0821917808219178,0.0821917808219178,24.47479225617245
65,"[""Anaesthetic gas may have been used against Jenson Button and his wife Jessica during a burglary in France, the Formula 1 driver's spokesman says.""]","['Two men, who stole jewellery including Jessica\'s engagement ring, may have pumped gas through the air conditioning before Monday\'s break-in, he said. The spokesman said they were unharmed but ""unsurprisingly shaken"". But medical experts said they were sceptical that burglars had used gas in the raid on the villa in Saint Tropez.']",0.22499999999999995,0.02564102564102564,0.12500000000000003,0.12500000000000003,31.435745509118785
66,"[""A Moscow court has rejected a female flight attendant's sex discrimination claim against the Russian national carrier Aeroflot.""]",['It is the second such claim to be rejected in court this week. The plaintiffs accused the airline of favouring slim and attractive cabin crew. Aeroflot said its rules were designed to ensure passenger safety.'],0.18518518518518517,0.0,0.11111111111111112,0.11111111111111112,30.250049335487645
67,['The parents of a Buckingham girl who was killed by a cyclist will be in the House of Commons later as their fight to change the law continues.'],"['Rhiannon Bennett, 17, was walking with friends when she was hit by cyclist Jason Howard on 2 April 2007. Howard was convicted of ""dangerous cycling"" and fined. Under the charge there was no penalty of imprisonment.']",0.1875,0.0,0.15625000000000003,0.15625000000000003,24.792344427963737
68,['Members of the Fire Brigades Union in England and Wales have held a further strike on Christmas Eve in a dispute over pensions.'],"['The strike lasting for five hours ended at midnight and further action is scheduled for the New Year. But members of the FBU in Surrey and Kent were recalled after flooding was declared a ""major incident"". Scottish firefighters voted against a strike but have joined an overtime ban.']",0.28169014084507044,0.05797101449275362,0.19718309859154928,0.19718309859154928,31.03225445135055
69,"[""An Irish policeman who claims some colleagues routinely cancelled motorists' penalty points is to give evidence to politicians.""]","['The Public Accounts Committee hearing is to go ahead in private, despite calls to cancel it by the head of the police and the minister for justice. They argued the government spending watchdog was not the appropriate forum. Sergeant Maurice McCabe claims there is corruption, with penalty points often being quashed for friends and family.']",0.16438356164383564,0.05633802816901408,0.08219178082191782,0.08219178082191782,30.141961599834556
70,"['Scores of councils in England say they cannot guarantee primaries will reopen on 1 June, throwing government plans to get pupils back to school into chaos.']","[""By Hannah RichardsonEducation and social affairs reporter Only 20 of 99 councils to respond to a BBC Breakfast survey said they were advising schools to open more widely on Boris Johnson's target date. Of the 99 who responded, two thirds (68), could not guarantee schools would reopen to Reception, Year 1 and Year 6. It comes as the government prepares to publish scientific advice on its plan.""]",0.21276595744680854,0.0,0.1702127659574468,0.1702127659574468,33.25168597066446
71,"['The first Large Blue butterflies at a Somerset nature reserve have begun emerging a month later than normal, the National Trust has said.']","[""Last summer about 50,000 eggs were laid at Collard Hill but the cooler spring temperatures slowed down their metamorphosis. Ranger, Ian Clemmett, said despite the late start they hoped for another good year building on previous years. The caterpillars pupate in ants' nests before they crawl out as butterflies.""]",0.136986301369863,0.0,0.0821917808219178,0.0821917808219178,27.153778797282325
72,['Dig out your cork wedges and designer sunglasses because Love Island is heading back to our screens.'],"[""Another group of toned and tanned singletons are turning to TV to help them out with their failed love lives. But Love Island is nothing without the villa, and it's been given a makeover for the 2018 season of the show. Changes have been made to the decor as well as some of the house rules.""]",0.16216216216216214,0.05555555555555556,0.13513513513513511,0.13513513513513511,26.33199283564519
73,"['The creator of a ""Swindon Town"" dress worn to the Baftas by Daisy May Cooper screamed when she saw it on the red carpet.']","['The cult BBC Three sitcom This Country picked up best scripted comedy and best female comedy performance for its star. The red football shirt dress made its debut on the red carpet at the Bafta Television Awards on Sunday evening. Dress creator Fiona Hesford said: ""You always think the worst - but when I saw her I thought she\'s so pulled it off."" Worn by the star of the BBC Three mockumentary, the red polyester crepe dress not only featured Swindon on the front, but ""Mucklowe"" - Cooper\'s character Kerry\'s surname - on the back.']",0.2857142857142857,0.05128205128205127,0.13445378151260504,0.13445378151260504,30.419467056322503
74,"['The rules on visiting residents in care homes are to be relaxed, the Scottish government has announced.']","['Indoor visits will no longer be limited to 30 minutes, and can now last up to four hours. Visitors will be allowed to hold hands with residents as long as they stick to rules to stop the infection spreading. And up to six visitors from two households, including children, will be able to attend outdoor visits which can last up to one hour.']",0.125,0.0,0.075,0.075,24.151154609292483
75,"['New technology is to be used to block mobile phones that have been smuggled into prison, even if the authorities are unable to find the device.']","[""The Scottish Prison Service (SPS) has been trialling techniques that can detect phones from their mobile signal. They are then able to block the phone, and seek a court order to completely remove the device from the network. This effectively makes the device useless, even if a different sim card is inserted into it, MSPs on the Scottish Parliament's justice committee have now approved the technology for use, after Justice Secretary Michael Matheson offered assurances that it was unlikely to interfere with mobile phones being used by people living close to prisons.""]",0.3361344537815126,0.06837606837606838,0.10084033613445378,0.10084033613445378,34.83514657247848
76,['A man has died after being found with serious injuries at a house in Birmingham.'],"['Police said they were called to an injured man at a house in Hunters Road, Lozells in the early hours of Sunday. He died later in hospital. Two men, both aged 43, have been arrested, one on suspicion of assault and the other on suspicion of wounding.']",0.1935483870967742,0.1,0.16129032258064516,0.16129032258064516,26.8658729700327
77,"[""HSBC's share price has fallen to its lowest level since 1995 amid allegations of money laundering.""]","['In 2013 and 2014 the bank allowed fraudsters to transfer millions of dollars around the world even after it had learned of their scam, leaked secret files show. HSBC says it has always met its legal duties on reporting such activity. On Monday in Hong Kong, the shares fell more than 5.3% to close at HK$29.30.']",0.13157894736842105,0.0,0.07894736842105263,0.07894736842105263,25.026451674202853
78,"['From gender-neutral bots to period-friendly healthcare trackers, cars with more storage and clothes with bigger pockets - the world could be a very different place if there were more women working in tech.']","['By Zoe KleinmanTechnology reporter, BBC News We asked a group of women who are working in the fields of science, technology, engineering and maths (Stem) how the world might be compared to now, if more women were present in these male-dominated industries. Now in its eighth year, the annual celebration of women working in Stem is named after the woman regarded as the world\'s first computer programmer - Ada Lovelace - because of her work with inventor Charles Babbage on his idea for an ""analytical engine"" in the 1800s. Kriti Sharma, director, Bots and AI, Sage ""If there were more women working in bots & Artificial Intelligence (AI), women wouldn\'t be an afterthought when building new technology.']",0.2119205298013245,0.09395973154362416,0.14569536423841062,0.14569536423841062,29.936216026622866
79,"['People who tried to escape from East Germany during the Cold War could be shot, jailed and tortured. But the government was so short of money that some ended up being secretly sold - to West Germany, the country most of them had been trying to reach in the first place.']","['By Gavin HainesLondon ""I found myself at a police station on my own. The counter seemed so high because I was only a little girl and I remember the policeman asking: \'Why are you not crying?\' I think about his words now and ask myself: \'Yeah, why wasn\'t I crying?\' I suppose I was in shock."" Daniela Walther recalls the night she was caught trying to flee East Berlin. It was 13 August 1961.']",0.16,0.016260162601626018,0.11200000000000002,0.11200000000000002,24.849545135960216
80,"['Fifteen rising music artists have been named on the longlist for the BBC Sound of 2014 , which showcases some of the brightest new acts for the year ahead.']","[""The list was compiled using tips from 170 tastemakers, who each named their favourite three emerging artists. Californian trio Haim came out on top last year, with Adele, Ellie Goulding and Jessie J also among past winners. This year's crop includes singers Sam Smith and Ella Eyre, who have both already featured on number one singles.""]",0.1411764705882353,0.0,0.07058823529411765,0.07058823529411765,25.800582993651844
81,"[""The US has said its decision to refuse an extradition request for Harry Dunn's alleged killer was final.""]","['It comes after an Interpol Red Notice was issued for US national Anne Sacoolas who is now ""wanted internationally"". A US official said she had diplomatic immunity, but Downing Street branded the refusal ""a denial of justice"". Mr Dunn, 19, died after a crash in Northamptonshire, with Mrs Sacoolas accused of death by dangerous driving.']",0.18918918918918917,0.0,0.08108108108108109,0.08108108108108109,21.313194230631364
82,['Chief Colombian government peace negotiator Humberto de la Calle has said the leftist Farc rebel group will be held to account for all the acts of violence it has committed.'],"['His comments come as peace negotiations resume in Cuba aimed at ending more than five decades of conflict. Mr de la Calle reaffirmed that the army would continue fighting until the end. More than 220,000 people are estimated to have been killed in the conflict, most of them civilians.']",0.2,0.05128205128205128,0.2,0.2,31.47913653257481
83,"['Hurricane Florence, which is nearing the US East Coast, could kill ""a lot of people"", officials warn.']","[""The Federal Emergency Management Agency (Fema) says storm surges could bring catastrophic flooding to inland areas. Nearly 1.7m people along the coastlines of North Carolina, South Carolina and Virginia have been ordered to evacuate. Strong winds and heavy rains have already begun lashing North Carolina's coastline, leading to some early flooding.""]",0.1142857142857143,0.0,0.08571428571428572,0.08571428571428572,20.482905639043295
84,"['In our series of letters from African journalist, Yousra Elbagir looks at how Sudanese youth are using social media to express their African identity.']","[""Sudan's President Omar al-Bashir has announced a strategic partnership with the Gulf Cooperation Council (GCC), a regional political organisation that brings together seven Arab states. The move comes after a series of bilateral talks and a stream of multi-million dollar investments from Saudi Arabia and the United Arab Emirates. While the East African nation's government leans ever closer to the Arab world - Sudan joined the Arab League two weeks after its independence in 1956 - millennials are taking to social media to celebrate their African heritage.""]",0.19469026548672566,0.07207207207207206,0.17699115044247787,0.17699115044247787,30.52673884240575
85,"['On a tiny stretch of the fast-flowing Valsan river in Romania lives one of the rarest fish in Europe, and quite possibly the world.']","['By Stephen McGrathCurtea de Arges, Romania The 65-million-year-old Asprete was first discovered by a biology student in 1956, and for decades it has teetered on the brink of extinction. ""After many years trying to save [it], people were telling us that the species was extinct,"" Nicolae Craciun, a 59-year-old biologist, told the BBC. ""But we were sure they still existed."" The Asprete, a small nocturnal fish that hides under rocks, has an uncertain future and faces myriad threats.']",0.18518518518518517,0.0,0.11111111111111109,0.11111111111111109,21.07882351932099
86,['Three families are due in court on Tuesday to challenge the decision to exclude non-religious beliefs from the new religious studies GCSE syllabus.'],"['By Judith BurnsEducation reporter From next year, the new GCSE will require pupils in England to study two religions but not humanism. The parents fear excluding humanism may lead children to believe religion ""has a monopoly on truth and on morality"". In February, former Archbishop of Canterbury the Right Reverend Lord Williams urged a government rethink.']",0.22500000000000003,0.02564102564102564,0.125,0.125,28.234834927809953
87,"['A low bridge in Leicestershire has been dubbed the ""most bashed"" in Britain after being struck 25 times in a year.']","['The Watling Street railway bridge on the A5 in Hinckley saw crashes almost once a fortnight on average in the year to the end of March, Network Rail said. Its list of the most commonly struck bridges also included structures in Dudley, Cambridgeshire and Norfolk. However, the organisation said there had been an 11% decrease in bridge crashes compared to the previous year.']",0.23809523809523808,0.024390243902439025,0.16666666666666666,0.16666666666666666,25.141899067376944
