,target,candidate,rouge1,rouge2,rogueL,rogueLs,chrf
0,"['Hackers who breached US government networks stole far more fingerprint records than first thought, officials have said.']","['In a statement, the White House said more than 5.6 million fingerprint records were stolen from the Office of Personnel Management (OPM). An initial investigation suggested only 1.1 million were lost. The OPM acts as the personnel office for the US government and keeps records on 21.5 million federal staff.']",0.2,0.058823529411764705,0.08571428571428572,0.08571428571428572,36.946595701247006
1,"['A ""major"" fire on Bognor Regis seafront has been brought under control.']","['Fourteen fire engines were sent to tackle the blaze, which affected a row of buildings on The Esplanade, in the early hours of Sunday. West Sussex fire service said some of the properties were derelict and the buildings were completely destroyed. Emergency teams were at the scene throughout Sunday and inspections by firefighters were due to continue throughout the night.']",0.08333333333333334,0.0,0.05555555555555555,0.05555555555555555,15.899761919599682
2,['The European Commission (EC) has launched an investigation into whether a major windfarm off the Devon coast could endanger wildlife.'],"['The 240-turbine Atlantic Array would be double the size of any windfarm currently operating in Britain. The EC confirmed it is taking up the matter with the UK Government due to the ""failure to propose protection sites for the harbour porpoise"". A Defra spokesperson they were working to identify further sites.']",0.1388888888888889,0.0,0.08333333333333334,0.08333333333333334,24.66532181391761
3,['A patient has been diagnosed with the rare viral infection monkeypox in the south west of England.'],"[""It is believed the patient contracted the infection while visiting Nigeria, Public Health England (PHE) said. According to the World Health Organisation, the condition is similar to human smallpox and although it is much milder, it can be fatal. The patient has been transferred to a specialist infectious disease centre at Guy's and St Thomas' in London.""]",0.24000000000000002,0.0547945205479452,0.10666666666666667,0.10666666666666667,29.729775112019137
4,"['UK inflation will quadruple to about 4% in the second half of next year and cut disposable income, a leading think tank has forecast.']","['By Chris JohnstonBusiness reporter The rise in prices will ""accelerate rapidly"" during 2017 as the fall in sterling is passed on to consumers, according to the National Institute for Economic and Social Research (NIESR). The revised figure is sharply higher than the 3% it forecast in August. The economy also faces ""significant risks"" that could restrict growth.']",0.14814814814814814,0.0,0.1234567901234568,0.1234567901234568,23.45612136325638
5,['Childish Gambino has made Grammy Awards history by winning both song and record of the year for This Is America.'],"['It\'s the first time a rap song has won both categories - although Gambino did not attend or perform at the event. He was the first artist to be absent from collecting one of the ""big four"" Grammys since Amy Winehouse in 2008. Gambino - aka actor Donald Glover - beat competition from Drake, Lady Gaga and Bradley Cooper in both categories.']",0.175,0.02564102564102564,0.1,0.1,25.32383535652584
6,['A cyclist has died in a crash with a van in Neath Port Talbot.'],"['A black Volkswagen Transporter was in collision with a cyclist on the A4109 at Banwen at 21:15 BST on Saturday. South Wales Police said the rider was declared dead at scene and shut the Inter-valley road between Banwen and Glyneath for five hours to investigate. Officers have appealed for witnesses or ""anyone who witnessed the manner of driving of the pedal cycle or vehicle prior to the collision""..']",0.11904761904761904,0.04878048780487805,0.09523809523809522,0.09523809523809522,16.9545599677204
7,"['Support from the Welsh NHS after sepsis was like being on a rollercoaster ""blindfolded"", a Tory politician who survived the illness has said.']","['By Eleanor Gruffydd-JonesBBC Politics Wales AM Angela Burns and the charity UK Sepsis Trust said help for survivors was non-existent. They want patients to be given more information when they are discharged and follow-up help with their recovery. More than 10,000 people get sepsis each year in Wales and about 2,000 of them die, the charity said.']",0.11764705882352941,0.0,0.11764705882352941,0.11764705882352941,25.253475747670706
8,"['A millipede so rare it is ""new to science"" and does not even have a common name, has been found in Neath Port Talbot.']","['Youngsters on a Halloween insect hunt found the bug at Craig Gwladus Country Park, near Cilfrew, on 30 October. It has since been identified as the Turdulisoma cf turdulorum millipede, so rare it is only the third known site where it has been found. The first was Aberkenfig, Bridgend, in 2017, by local expert Christian Owen.']",0.25,0.15384615384615385,0.25,0.25,29.315751029323323
9,['The parents of a boy who died in the 2014 floods have publicly thanked those who helped raise money for a lawyer to represent them at his inquest.'],"['The family said they could not have afforded a QC themselves after the Legal Aid Agency decided the case ""was not in the public interest"". Seven-year-old Zane Gbangbola died at his home next to the Thames in Chertsey, Surrey on 8 February 2014. The coroner is to deliver his verdict on 6 or 7 September.']",0.23529411764705885,0.04819277108433735,0.16470588235294117,0.16470588235294117,27.636380210930696
10,['A new memorial has been unveiled to remember freeminers who died in mining accidents in the Forest of Dean.'],"['The 7ft (2.13m) monument made of steel and stone stands next to Pan Tod beacon on Ruardean Hill, Gloucestershire and records the names of 50 men. It has been built by ex-miner Ernie Hughes whose father Leslie died at the Northern United colliery in Cinderford in 1951, aged 45. Mr Hughes said he had wanted to set up the memorial ""all his life"".']",0.2142857142857143,0.024390243902439025,0.14285714285714285,0.14285714285714285,27.101955616642172
11,"[""A review aimed at modernising Alderney's financial relationship with Guernsey is due to take a year.""]","['It follows concerns over the way public services in Alderney will be funded in the future. The review involves measuring all the islands\' public costs and revenue, including Guernsey States-owned airline Aurigny. Guernsey\'s Deputy Chief Minister Allister Langlois said there was ""a great deal of work to do"".']",0.1791044776119403,0.0,0.08955223880597014,0.08955223880597014,27.1602947241533
12,"['Across the African continent, internet penetration is low, computers are often too expensive to purchase, and online business transactions can be logistically complicated to execute.']","['By Meredith BakerBBC News, Johannesburg But the surge in mobile phone use - there are currently 695 million mobile phone subscribers in Africa - has given Africans a simple and pervasive means of sharing information and conducting business. In recent years, a few innovative African companies have found ways to harness the e-potential of mobile commerce and information sharing, changing the way in which Africans communicate and conduct business. SlimTrader, founded by Nigerian-American Femi Akinde, is an e-commerce firm that is meant to ease the exchange of goods and widen the online markets for Africans.']",0.1487603305785124,0.0,0.09917355371900827,0.09917355371900827,28.424519038480394
13,['A West Yorkshire care home which built its own sealed visiting booth said it has been inundated with messages from other homes asking how it was done.'],"[""The wood and plastic booth was built around a patio door at Vicarage Court, Featherstone, in under three hours. Director Jagjit Singh, who built the pod with a staff member, posted a picture on the home's Facebook page and it got thousands of views and messages. Almost 50 care homes have been in touch to ask where they can get one.""]",0.24719101123595505,0.0,0.11235955056179775,0.11235955056179775,33.64150954804172
14,['A white tailed sea eagle chick that swallowed two fish hooks and became wrapped up in the lines attached to them has been saved by the SSPCA.'],['The six-week-old male bird was found at Loch Arkaig in Lochaber. The Scottish SPCA first took the chick to Inverness and then to its national rescue centre in Alloa for treatment. It will remain with the animal charity until it fledges at about 12-weeks-old and will then be released near the loch.'],0.14457831325301204,0.0,0.12048192771084336,0.12048192771084336,25.83174108956913
15,"['A law company set up by three councils to save money has warned of ""uncertainties"" that could threaten its future after posting a £1.2m loss.']","['LGSS Law is owned by three councils and was founded to offer a ""new model"" for public sector legal services. Critics called the fall in revenue and £1.2m loss in 2018-19 a concern while an independent councillor questioned the scrutiny of outsourced services. LGSS Law said its finances had improved and it expected a profit this year.']",0.28235294117647064,0.0963855421686747,0.21176470588235294,0.21176470588235294,30.935432181113594
16,"['When police learned a suspected lion was on the loose in an Essex village, they brought in helicopters with thermal imaging kit and experts from a nearby zoo.']","['By Laurence CawleyBBC News That search, which took place on Sunday and Monday, has now been called off after they were unable to ""find any trace of any animal"". The most likely explanation for the sighting now appears to be that the suspected big cat was Ginny Murphy\'s pet Teddy Bear, a three-year-old Maine Coon cat. The drama, which unfolded over the bank holiday, has amused those for whom tracking big cats is a day job.']",0.14953271028037385,0.0,0.07476635514018692,0.07476635514018692,23.94858176230735
17,['A probation officer who had been monitoring a serial offender when he went on to murder a teenager told an inquest she did the best she could under the heavy workload.'],"['Conner Marshall, 18, was beaten to death at Trecco Bay in Porthcawl in March 2015. Killer David Braddon, who was 26 at the time, pleaded guilty to murder and is serving a life sentence. Braddon was subject to two community orders at the time.']",0.16,0.0273972602739726,0.13333333333333333,0.13333333333333333,25.450255334678427
18,"['After Prime Minister David Cameron announced the return of the British Empire Medal (BEM), we tell the stories of some of the local heroes who were honoured the first time round.']","['By Gerry HoltBBC News Sometimes seen as a ""working-class gong"", the BEM was founded in 1917 and was awarded for ""meritorious"" actions whether by civilians or military personnel. But the honour was scrapped in 1993 by former Conservative Prime Minister John Major, as part of his drive towards a ""classless"" society. However, nearly two decades on, the prime minister has announced its revival, and from next year, to coincide with the Queen\'s Diamond Jubilee, about 300 will be awarded annually to community volunteers.']",0.15517241379310345,0.017543859649122806,0.10344827586206896,0.10344827586206896,27.93843754859051
19,"['The death of Simegnew Bekele, the project manager of the multi-billion-dollar Grand Ethiopian Renaissance Dam, has been met by an outpouring of grief in Ethiopia.']","[""By Tara JohnBBC News Condolences flooded social media from journalists, businessmen academics, ambassadors and even flag-carrying Ethiopian Airlines after it was reported that Mr Simegnew's body was found in a car in the capital, Addis Ababa, on Thursday. The police are investigating the circumstances of his death. He died as a result of a bullet wound and a hand gun was found in his car, which was parked in Meskel Square in the city centre.""]",0.19230769230769232,0.0,0.09615384615384616,0.09615384615384616,25.32073146187801
20,"[""A court in the United States has sentenced a Singapore national for conspiring to provide material support to Sri Lanka's Tamil Tigers.""]","['Haniffa Bin Osman, 57, was sentenced to 37 months in prison by the district judge in Baltimore on Friday. He was accused of aiding the LTTE in the attempted purchase of Surface to Air Missiles, Night Vision of Devices, Machine Guns and State of the Art Firearms. The attempts were made from April to September 2006 together with Haji Subandi, Erick Wotulo and Thirunavukarasu Varatharasa, a statement by the US Justice Department said.']",0.125,0.02127659574468085,0.08333333333333333,0.08333333333333333,24.982109634873815
21,['Forecasters have extended warnings for thunderstorms across the whole of Wales until Monday evening.'],"['A yellow alert is in place from Friday, with the Met Office saying there could be heavy downpours during any storms, with up to 50mm of rain in short bursts over two to three hours. It could lead to flash flooding in places, travel disruption, and the slight risk of power cuts. The alerts remain in place until 21:00 BST on Monday.']",0.10389610389610389,0.0,0.10389610389610389,0.10389610389610389,23.455814093551965
22,['Scientists have obtained remarkable new insights into the asteroid impact that wiped out the dinosaurs.'],"[""By Jonathan AmosBBC Science Correspondent, Bremen They have been examining rocks from the crater that the 15km-wide space object dug out of what is now the Gulf of Mexico some 66 million years ago. The team says it can see evidence in these materials for how life returned to the scene soon after the calamity. Descendants of these small organisms are likely thriving today in amongst the crater's smashed up materials.""]",0.11363636363636363,0.0,0.11363636363636363,0.11363636363636363,21.74959844143544
23,"[""It is a humiliating day for Co-op Group, or at least its previous management, because there is confirmation in today's rescue deal for Co-op Bank that the value of the bank has collapsed to nothing.""]","['Robert PestonEconomics editor One reason why this bank should stay afloat is because Co-op Group is injecting £462m into it. But even so, Co-op Group will emerge with a holding in the bank of just 30%. Or to put it another way, the value of its current 100% ownership of the bank is being valued at a big fat zilch.']",0.42,0.14285714285714288,0.26000000000000006,0.26000000000000006,35.509730398433774
24,"[""Benedict Cumberbatch, Dame Helen Mirren and Dame Maggie Smith will be among the British stars on the red carpet at this year's London Film Festival.""]","[""The October event will include the UK premiere of crime drama Black Mass, starring Johnny Depp and Cumberbatch. The Lady in the Van, starring Dame Maggie as an elderly woman who lives on writer Alan Bennett's driveway, will have its European premiere in London. Bryan Cranston and Dame Helen Mirren's film Trumbo will have a gala screening.""]",0.32941176470588235,0.0963855421686747,0.16470588235294117,0.16470588235294117,37.55823132613024
25,['The taxpayer is owed more than £50m as a result of the collapse of ship building firm Ferguson Marine.'],"['By Andrew PickenBBC Scotland News New figures from the administrator of the yard show £49.7m is owed to the Scottish government - nearly £5m more than previously revealed. A total of £426,000 is also owed to HMRC. The Scottish government said it provided two commercial loans totalling £45m to Ferguson Marine, on which interest applies.']",0.29333333333333333,0.1095890410958904,0.26666666666666666,0.26666666666666666,28.88007404978195
26,"['Aboriginal Australian actor ""Uncle"" Jack Charles says he has been refused taxi rides two times in three days.']","['By Ashley DonnellyBBC News, Sydney Mr Charles\' manager, Patrice Capogreco, said the actor may take legal action against the drivers and taxi company. The first incident occurred on Wednesday night after a Melbourne event where Mr Charles was declared Victorian Senior Australian of the Year. When Mr Charles tried to get in a taxi the driver allegedly demanded upfront payment because ""he might not pay"".']",0.14457831325301207,0.0,0.07228915662650603,0.07228915662650603,25.868366117227488
27,"[""A photograph of a man sleeping in a McDonald's in Fayette County, Georgia, has gone viral - but perhaps not for the intended reason.""]","['By George PierpointBBC News The photograph was shared on a local Facebook group, with a caption stating it was ""just another reason... to leave Fayetteville"", along with an angry emoji. However, after it transpired the man was homeless and resting between working two shifts at the fast-food restaurant, the local community decided to offer support, rather than ridicule him.']",0.14285714285714288,0.0,0.09523809523809522,0.09523809523809522,28.444014841613065
28,"['Taxes must increase or services be cut to compensate for the loss of fuel tax income thanks to the advent of electric cars, the Treasury has admitted.']",['By Roger HarrabinBBC environment analyst Officials have been long concerned about the future loss of more than £30bn in revenue from drivers. In a new review the Treasury has acknowledged the problem in a way that will spark a debate about how driving should be taxed in the future. One idea would be to charge motorists for every mile they drive.'],0.22727272727272727,0.06976744186046512,0.13636363636363638,0.13636363636363638,28.52421571864121
29,['Performances at the Latitude Festival were suspended for about an hour after lightning and heavy rain caused the power to be turned off.'],"['Organisers of the event at Henham Park, Suffolk, said performances were paused on the Obelisk Arena Stage, the BBC Sounds Stage and the Lake stage, as a precaution. They were waiting for ""inclement weather to pass"" they said on Twitter. ""Lightning is the concern, not rain"" it said after people complained of delays.']",0.2894736842105263,0.0,0.15789473684210525,0.15789473684210525,32.45653036418093
30,['Celebrations have been held to mark the 200th anniversary of the opening of the Monmouthshire and Brecon Canals.'],"['Enthusiasts recreated the original opening of the waterway in 1812 at Pontymoile Basin with church bells sounding along the route. The 49-mile, canal built to transport coal and iron, winds its way south from Brecon to Cwmbran, Newport and Cwmcarn. Today it is popular with tourists on canal boat holidays.']",0.23188405797101447,0.05970149253731344,0.1739130434782609,0.1739130434782609,26.403340892475075
31,['Wind power firms warn they may take the government to court if they get caught in a political row over subsidies.'],"['By Roger HarrabinEnvironment analyst After conducting technical studies, the energy department proposed a subsidy cut of 10% for power from onshore wind. But the chancellor is under pressure from back-benchers to scrap subsidies, and is said to favour a 25% cut. The industry body, Renewable UK, says it may take legal action if the government makes a decision that overrides its own technical evidence.']",0.23255813953488375,0.047619047619047616,0.13953488372093023,0.13953488372093023,30.87061393577083
32,['A council has said it may temporarily remove a statue of Robert Baden-Powell from public view after critics accused the Scout movement founder of racism.'],"['Former Labour parliamentary candidate Corrie Drew said he was homophobic and ""an enthusiastic supporter of Hitler"". The website Topple the Racists said he committed ""atrocities against the Zulus in his military career"". However, some historians have argued the allegations are either unfair or entirely unfounded.']",0.08450704225352113,0.0,0.08450704225352113,0.08450704225352113,24.85665147581279
33,"['Almost three-quarters of universities in England are planning to charge the maximum £9,000 tuition fee for some or all of their courses, according to Office for Fair Access (Offa) figures.']","['By Sean CoughlanBBC News education correspondent The average fee level for 2014-15 will rise by about £150 to about £8,650. But the total amount to be spent on supporting poorer students will also rise to £708m, up from £672m. Offa director Les Ebdon said universities were spending ""increasingly smartly"".']",0.16867469879518074,0.0,0.12048192771084337,0.12048192771084337,25.197337999961324
34,"['An MSP has voiced her ""deep sadness"" over the killing of the founder of the first Buddhist monastery in the UK.']","['Dr Akong Rinpoche set up the Samye Ling Tibetan centre in Dumfries and Galloway in 1967. A statement from police in the Chinese city of Chengdu on Tuesday said Dr Rinpoche, his nephew and his driver had been killed in a residential area. Dumfriesshire MSP Elaine Murray said he had been an influential figure in southern Scotland and beyond.']",0.15000000000000002,0.025641025641025644,0.1,0.1,20.193816412676334
35,['Google has gained hundreds of patents from IBM as it continues its intellectual property spending spree.'],"['It has acquired 187 patents and 36 applications, adding to the 1,000 it purchased from IBM last summer. The latest patents include a system for ""using semantic networks to develop a social network"". Google has spent billions building its technology rights portfolio, including a $12.5bn (£7.7bn) deal for Motorola Mobility.']",0.2028985507246377,0.05970149253731343,0.14492753623188406,0.14492753623188406,28.446034861315127
36,['Lunchtime can be the highlight of any working day - until you open the fridge door to find your lunch has vanished.'],"[""The extent of the problem was highlighted after a man's Twitter thread documenting the theft of a co-worker's shrimp fried rice was liked more than 400,000 times. Los Angeles-based Zak Toscani said his colleague was able to trace the person responsible by watching CCTV footage. The plot thickened when it was revealed a colleague had binned the fried rice.""]",0.09411764705882353,0.0,0.09411764705882353,0.09411764705882353,24.635187812384547
37,"['Some house sales are falling through because of delays to property searches during the Covid-19 pandemic, a solicitor has warned.']","['Solicitors ask local authorities to carry out the searches on issues including planning and traffic. Telor Dyer, a residential conveyancer in Carmarthenshire, said waiting times in some parts of Wales had doubled to 30 working days. Pembrokeshire council said it had a backlog after the lockdown in March.']",0.17391304347826086,0.0,0.11594202898550725,0.11594202898550725,26.690201029966275
38,"['A cocaine-user stabbed his grandmother 30 times after building up a £35,000 gambling debt, a court was told.']","[""Gregory Irvin is alleged to have murdered 74-year-old Anne James during a visit to her home in Doveridge Place, Walsall, in February. Prosecutor Rachel Brand QC said blood matching that of Mrs James was found on Mr Irvin's jacket and the accelerator of his Mini after her death. Mr Irvin, 26, of Bilboe Road, Bilston, denies murder.""]",0.1,0.0,0.075,0.075,18.44613913980833
39,"[""Bullfighting fans in Catalonia have seen the last fights before a ban on the age-old tradition comes into effect in Spain's north-eastern region.""]","[""About 20,000 spectators filled Barcelona's famous Monumental arena, where top matadors performed. Lawmakers voted for the ban last year - the first in mainland Spain - after 180,000 people signed a petition. They say the bullfighting is barbaric, but opponents say they will challenge the ban in Spain's top court.""]",0.2564102564102564,0.05263157894736842,0.17948717948717946,0.17948717948717946,30.50066023830197
40,"[""A major campaign's been launched to help stop small music venues closing.""]","['By Hannah MooreNewsbeat reporter Around a third of the UK\'s small gig spaces have closed in the past decade, according to Music Venue Trust. ""These venues are run by passionate people who really want live music to happen in their local town or city, they\'re not profit making"" says CEO Mark Davyd. The charity\'s Fightback 2017 campaign will raise money to help venue owners.']",0.19999999999999998,0.02564102564102564,0.12499999999999999,0.12499999999999999,24.436762224302257
41,['A scheme has been set up which aims to bring uninhabitable properties back into use in Cornwall.'],"['Cornwall Council plans to provide low-interest finance for owners who cannot raise money through conventional lenders for renovations. The council says there are more than 3,500 uninhabitable properties in the county. It is holding an open day on Friday in St Austell to provide more information about the Empty Property Loan Scheme.']",0.16901408450704225,0.028985507246376812,0.11267605633802816,0.11267605633802816,33.00785892130236
42,"[""The crisis in Ukraine has refocused minds at the North Atlantic Treaty Organization (Nato) on the threat posed by Russia and the need to improve the alliance's collective defence capability.""]","[""By Jonathan BealeDefence correspondent, BBC News At this week's summit in Newport in Wales, Nato heads of state will agree on a Readiness Action Plan to respond to such crises. It will involve setting up a new spearhead force of 4-5,000 troops, ready to deploy within 48 hours. The alliance is also committed to boosting its intelligence gathering and sharing with the use of spy planes and unmanned drones.""]",0.21359223300970875,0.019801980198019802,0.11650485436893204,0.11650485436893204,27.424978649891766
43,"[""Royal Bank of Scotland (RBS) has sold Coutts International, the overseas arm of the private bank, to Switzerland's Union Bancaire Privee (UBP).""]","[""A spokesperson for Coutts International said both parties had agreed not to disclose the price of the deal. The bank has been owned by RBS since 2000, managing assets of more than $30bn (£20.2bn). The sale is part of RBS's policy of selling international assets to create a UK-focused bank.""]",0.3157894736842105,0.05405405405405406,0.1842105263157895,0.1842105263157895,30.805878748742998
